{
  "$schema": "https://json-schema.org/draft/2020-12/schema",
  "$id": "https://schemas.8005-agv.local/agv-full-product/v7/messages/FaultCargoRecoveryResult.schema.json",
  "title": "FaultCargoRecoveryResult",
  "type": "object",
  "properties": {
    "protocolVersion": {
      "type": "integer",
      "const": 7
    },
    "profileId": {
      "type": "string",
      "minLength": 1,
      "const": "AGV_FULL_PRODUCT"
    },
    "protocolReleaseVersion": {
      "type": "string",
      "minLength": 1,
      "pattern": "^[0-9]+\\.[0-9]+\\.[0-9]+$",
      "examples": [
        "6.0.0"
      ]
    },
    "protocolReleaseManifestSha256": {
      "$ref": "https://schemas.8005-agv.local/agv-full-product/v7/common/types.schema.json#/$defs/Sha256"
    },
    "messageType": {
      "type": "string",
      "minLength": 1,
      "const": "FaultCargoRecoveryResult"
    },
    "messageId": {
      "$ref": "https://schemas.8005-agv.local/agv-full-product/v7/common/types.schema.json#/$defs/Id"
    },
    "correlationId": {
      "type": "null"
    },
    "agvId": {
      "type": "string",
      "minLength": 1,
      "examples": [
        "AGV-8005-01"
      ]
    },
    "sessionGeneration": {
      "$ref": "https://schemas.8005-agv.local/agv-full-product/v7/common/types.schema.json#/$defs/Generation"
    },
    "sentAt": {
      "$ref": "https://schemas.8005-agv.local/agv-full-product/v7/common/types.schema.json#/$defs/Instant"
    },
    "payload": {
      "type": "object",
      "properties": {
        "exceptionRecoverySessionId": {
          "$ref": "https://schemas.8005-agv.local/agv-full-product/v7/common/types.schema.json#/$defs/Id"
        },
        "recoveryActionId": {
          "$ref": "https://schemas.8005-agv.local/agv-full-product/v7/common/types.schema.json#/$defs/Id"
        },
        "demandId": {
          "$ref": "https://schemas.8005-agv.local/agv-full-product/v7/common/types.schema.json#/$defs/Id"
        },
        "handoffId": {
          "$ref": "https://schemas.8005-agv.local/agv-full-product/v7/common/types.schema.json#/$defs/Id"
        },
        "overallOutcome": {
          "type": "string",
          "enum": [
            "HANDED_OFF",
            "FAILED",
            "UNKNOWN"
          ]
        },
        "slotResults": {
          "type": "array",
          "items": {
            "$ref": "https://schemas.8005-agv.local/agv-full-product/v7/common/types.schema.json#/$defs/SlotResult"
          },
          "minItems": 1,
          "maxItems": 8,
          "uniqueItems": true
        },
        "operator": {
          "$ref": "https://schemas.8005-agv.local/agv-full-product/v7/common/types.schema.json#/$defs/OperatorContext"
        },
        "observedAt": {
          "$ref": "https://schemas.8005-agv.local/agv-full-product/v7/common/types.schema.json#/$defs/Instant"
        }
      },
      "required": [
        "exceptionRecoverySessionId",
        "recoveryActionId",
        "demandId",
        "handoffId",
        "overallOutcome",
        "slotResults",
        "operator",
        "observedAt"
      ],
      "additionalProperties": false
    }
  },
  "required": [
    "protocolVersion",
    "profileId",
    "protocolReleaseVersion",
    "protocolReleaseManifestSha256",
    "messageType",
    "messageId",
    "correlationId",
    "agvId",
    "sessionGeneration",
    "sentAt",
    "payload"
  ],
  "additionalProperties": false
}
