{
  "protocolVersion": 7,
  "profileId": "AGV_FULL_PRODUCT",
  "protocolReleaseVersion": "6.0.0",
  "protocolReleaseManifestSha256": "0000000000000000000000000000000000000000000000000000000000000000",
  "messageType": "FaultCargoRecoveryResult",
  "messageId": "00000000-0000-4000-8000-000000000098",
  "correlationId": null,
  "agvId": "AGV-8005-01",
  "sessionGeneration": 1,
  "sentAt": "2026-08-25T09:00:00Z",
  "payload": {
    "exceptionRecoverySessionId": "00000000-0000-4000-8000-000000000001",
    "recoveryActionId": "00000000-0000-4000-8000-000000000001",
    "demandId": "00000000-0000-4000-8000-000000000001",
    "handoffId": "00000000-0000-4000-8000-000000000001",
    "overallOutcome": "HANDED_OFF",
    "slotResults": [
      {
        "slotNo": 1,
        "outcome": "COMPLETED",
        "finalPhysicalState": "EMPTY",
        "lockState": "LOCKED",
        "unlockOutputState": "RESET",
        "reasonCodes": [
          "ACTION_NOT_ALLOWED_IN_STATE"
        ]
      }
    ],
    "operator": {
      "operatorId": "operatorId-test",
      "verificationMethod": "BADGE",
      "verifiedAt": "2026-08-25T09:00:00Z"
    },
    "observedAt": "2026-08-25T09:00:00Z"
  }
}
